{
  "$schema": "https://json-schema.org/draft/2020-12/schema",
  "$id": "stage13-decision-dossier/v2",
  "type": "object",
  "additionalProperties": false,
  "required": [
    "schema_version", "status", "created_date", "implementation_base",
    "authority_owner", "scientific_data", "production_eligible",
    "definitive_execution_started", "evidence_firewall", "approval",
    "recommended_package_id", "decisions", "deferred_decisions",
    "package_alternatives", "supersedes", "benchmark_evidence",
    "resource_projection"
  ],
  "properties": {
    "schema_version": {"const": "stage13-decision-dossier/v2"},
    "status": {"const": "recommended_package_pending_alex_approval"},
    "created_date": {"type": "string", "format": "date"},
    "implementation_base": {"type": "string", "pattern": "^[0-9a-f]{40}$"},
    "authority_owner": {"const": "Alex"},
    "scientific_data": {"const": false},
    "production_eligible": {"const": false},
    "definitive_execution_started": {"const": false},
    "evidence_firewall": {"type": "object"},
    "approval": {
      "type": "object",
      "additionalProperties": false,
      "required": ["status", "required_approver", "approved_package_id", "approval_date", "approval_text", "dossier_sha256"],
      "properties": {
        "status": {"const": "pending"},
        "required_approver": {"const": "Alex"},
        "approved_package_id": {"const": null},
        "approval_date": {"const": null},
        "approval_text": {"const": null},
        "dossier_sha256": {"const": null}
      }
    },
    "recommended_package_id": {"const": "stage13-package-a-conservative-protected/v2"},
    "decisions": {
      "type": "array", "minItems": 13, "maxItems": 13,
      "items": {
        "type": "object",
        "required": ["decision_id", "question", "downstream_consequences", "stage11_direction", "stage12_evidence", "viable_options", "invalid_options", "protected_tier_consequences", "recommendation", "rationale", "uncertainty", "amendment_consequence", "requires_alex_choice"]
      }
    },
    "deferred_decisions": {"type": "array", "minItems": 1, "maxItems": 1},
    "package_alternatives": {"type": "array", "minItems": 3, "maxItems": 3},
    "supersedes": {"type": "object"},
    "benchmark_evidence": {"type": "object"},
    "resource_projection": {"type": "object"}
  }
}
