{
  "approval": {
    "approval_date": null,
    "approval_text": null,
    "approved_package_id": null,
    "dossier_sha256": null,
    "required_approver": "Alex",
    "status": "pending"
  },
  "authority_owner": "Alex",
  "benchmark_evidence": {
    "classification": "constructed non-scientific evidence",
    "file_sha256": "fca4f4d7915a36fb18e82e34159d53ad67708e34d4505c74d194987617a37ced",
    "hard_concrete_profile": "516 components, 5000 steps, checkpoint every 50, retention 2; median 2623.751 native steps/s",
    "ordinary_restart_profile": "16 restarts, 256 exact allowance including intact; median 0.667390 s for bridge mechanics",
    "path": "followup/benchmarks/stage13_search_profile_benchmark_v1.json",
    "scope_limit": "does not benchmark model forward/backward work, CUDA, or campaign concurrency"
  },
  "created_date": "2026-08-31",
  "decisions": [
    {
      "amendment_consequence": "Changing seeds, task formula, or matched rule after approval requires a prospective amendment before Stage 15 and invalidates all affected manifest hashes.",
      "decision_id": "RD-001",
      "downstream_consequences": [
        "population sample size",
        "teacher and student job counts",
        "paired phase estimands",
        "explicit unavailable-cell accounting"
      ],
      "invalid_options": [
        "replace an unavailable seed after seeing circuit endpoints",
        "impute a missing phase",
        "treat the historical 15-cell Stage 3 roster as the new answer",
        "choose Task 3 from outcome direction"
      ],
      "protected_tier_consequences": {
        "tier1": "45 fixed Task 1 teacher-phase cells before unavailability; three phases for each of 15 seeds.",
        "tier2": "Task 2 uses fixed seeds 0-4 at pre and stable-post phases.",
        "tier3": "Task 3 is the fixed polynomial task and runs only after protected completeness."
      },
      "question": "Which teachers, tasks, phases, and matched-primary inclusion rule define the population?",
      "rationale": "A fixed roster and algebraically fixed breadth tasks are outcome-independent; 15 teachers directly addresses the population critique while explicit unavailability preserves honesty.",
      "recommendation": {
        "matched_primary_rule": "teacher seed must have both primary phase landmarks; the 50% cell may be absent without invalidating the primary pair",
        "option": "A",
        "phase_rule": "historical-stage3-phase-selection/stage3-frozen/v1 using training metrics only",
        "phases": [
          "pre-grokking",
          "50%",
          "stable post-grokking"
        ],
        "primary_phase_contrast": [
          "pre-grokking",
          "stable post-grokking"
        ],
        "replacement_rule": "none",
        "task1": {
          "domain": "full 113x113",
          "family": "modular_addition",
          "modulus": 113
        },
        "task2": {
          "domain": "full 59x59",
          "family": "modular_multiplication",
          "modulus": 59,
          "role": "protected Tier 2 external validity"
        },
        "task3": {
          "domain": "full 59x59",
          "family": "modular_polynomial",
          "formula": "(x^2 + x*y + y^2) mod 59",
          "modulus": 59,
          "role": "optional Tier 3"
        },
        "teacher_seeds": [
          0,
          1,
          2,
          3,
          4,
          5,
          6,
          7,
          8,
          9,
          10,
          11,
          12,
          13,
          14
        ],
        "teacher_training": "canonical predecessor architecture and configs/model.yaml plus configs/training.yaml, trained from scratch for at most 40000 updates"
      },
      "requires_alex_choice": true,
      "stage11_direction": "Expand beyond five predecessor seeds toward approximately fifteen; Task 1 is protected mod-113 addition, Task 2 is reduced multiplication, and Task 3 is capacity-contingent polynomial breadth.",
      "stage12_evidence": "P1 can construct all three task families, train/resume teachers, apply the historical metric-only phase rule, and emit unavailable cells without scientific execution.",
      "uncertainty": "The fixed roster may yield fewer than 15 matched seeds and Task 2/3 training feasibility remains to be qualified operationally.",
      "viable_options": [
        {
          "description": "Fixed seeds 0-14 with no replacement; three metric-selected phases; paired primary uses seeds with both pre and stable-post phases.",
          "option": "A",
          "tradeoff": "Exactly prospective and simple, but fewer than 15 matched units if a seed lacks a phase."
        },
        {
          "description": "Fixed seeds 0-19 and retain the first 15 complete seeds by seed order.",
          "option": "B",
          "tradeoff": "More likely to reach 15 matched units, but adds training and a phase-availability selection layer."
        },
        {
          "description": "Retain the five predecessor teachers only.",
          "option": "C",
          "tradeoff": "Cheapest but does not repair the red-team population limitation."
        }
      ]
    },
    {
      "amendment_consequence": "Any roster or assignment change after approval requires a prospective amendment and re-sealing of affected scientific and manifest profiles.",
      "decision_id": "RD-002",
      "downstream_consequences": [
        "student training volume",
        "component denominators",
        "basis compatibility",
        "conditional architecture summaries"
      ],
      "invalid_options": [
        "infer architecture from checkpoint shape",
        "count architectures as population replicates",
        "full factorial",
        "reassign after endpoint inspection"
      ],
      "protected_tier_consequences": {
        "tier1": "Canonical architecture only.",
        "tier2": "All four alternates share anchor seeds 0-4, pre/stable phases, both conditions, and two eligible students per cell; 80 cells and 160 eligible-student targets.",
        "tier3": "Additional architecture-seed crossings only in fixed priority order."
      },
      "question": "Which student architectures and initialization assignments form the canonical and external-validity panel?",
      "rationale": "Every alternate is connected to canonical through the same teacher checkpoints, so architecture contrasts no longer confound architecture with teacher seed.",
      "recommendation": {
        "architectures": [
          {
            "d_head": 32,
            "d_mlp": 512,
            "d_model": 128,
            "id": "predecessor-matched/v1",
            "n_heads": 4,
            "n_layers": 1,
            "role": "canonical"
          },
          {
            "d_head": 32,
            "d_mlp": 512,
            "d_model": 128,
            "id": "depth-2-matched-width/v1",
            "n_heads": 4,
            "n_layers": 2,
            "role": "alternate"
          },
          {
            "d_head": 16,
            "d_mlp": 512,
            "d_model": 128,
            "id": "heads-8-matched-width/v1",
            "n_heads": 8,
            "n_layers": 1,
            "role": "alternate"
          },
          {
            "d_head": 32,
            "d_mlp": 256,
            "d_model": 128,
            "id": "mlp-256-matched-residual/v1",
            "n_heads": 4,
            "n_layers": 1,
            "role": "alternate"
          },
          {
            "d_head": 32,
            "d_mlp": 1024,
            "d_model": 128,
            "id": "mlp-1024-matched-residual/v1",
            "n_heads": 4,
            "n_layers": 1,
            "role": "alternate"
          }
        ],
        "initialization_rule": "domain-separated seed from full condition identity and fixed initialization slot; no opportunistic substitution",
        "option": "A",
        "permitted_contrasts": "Within the identical teacher seed, phase, and condition, alternate-architecture student-cell median minus canonical-architecture student-cell median; aggregate only complete pairs over teacher seeds. Architecture results are conditional external-validity contrasts, not isolated causal effects of depth, heads, or width.",
        "tier2_assignment": {
          "anchor_teacher_seeds": [
            0,
            1,
            2,
            3,
            4
          ],
          "architectures_on_every_anchor": [
            "depth-2-matched-width/v1",
            "heads-8-matched-width/v1",
            "mlp-256-matched-residual/v1",
            "mlp-1024-matched-residual/v1"
          ],
          "assignment_type": "complete shared fixed-anchor block",
          "conditions": [
            "hard",
            "soft"
          ],
          "phases": [
            "pre-grokking",
            "stable post-grokking"
          ],
          "unavailable_rule": "retain unavailable; no seed or checkpoint replacement"
        }
      },
      "requires_alex_choice": true,
      "stage11_direction": "Canonical predecessor-matched architecture plus at most five families in a balanced sparse assignment; no isolated causal architecture claim.",
      "stage12_evidence": "P2 validates injected multi-layer architectures, architecture-bound identities, parameter/component accounting, checkpoint resume, eligibility, and sealing. The v1 disjoint-seed allocation was not contrast-identifiable and is superseded.",
      "uncertainty": "Architecture training eligibility may differ; those differences remain reportable rather than repaired by reassignment.",
      "viable_options": [
        {
          "description": "Five-family panel: canonical plus depth, head-granularity, narrow-MLP, and wide-MLP variants, all crossed with the same fixed anchor seeds 0-4.",
          "option": "A",
          "tradeoff": "Broad external validity with bounded Tier 2 cost."
        },
        {
          "description": "Canonical plus two alternates only.",
          "option": "B",